{
    "$schema": "http:\/\/json-schema.org\/draft-04\/schema#",
    "type": "object",
    "required": [
        "address",
        "bar",
        "phoneNumber",
        "test"
    ],
    "properties": {
        "address": {
            "type": "object",
            "required": [
                "city",
                "streetAddress"
            ],
            "properties": {
                "streetAddress": {
                    "type": "string"
                },
                "city": {
                    "type": "string"
                }
            }
        },
        "bar": {
            "type": "object",
            "required": [
                "barAddress",
                "city"
            ],
            "properties": {
                "barAddress": {
                    "type": "string"
                },
                "city": {
                    "type": "string"
                }
            }
        },
        "phoneNumber": {
            "type": "array",
            "items": {
                "anyOf": [
                    {
                        "type": "object",
                        "required": [
                            "number",
                            "type"
                        ],
                        "properties": {
                            "type": {
                                "type": "string"
                            },
                            "number": {
                                "type": "string"
                            }
                        }
                    },
                    {
                        "type": "object",
                        "required": [
                            "digits",
                            "number",
                            "type"
                        ],
                        "properties": {
                            "type": {
                                "type": "string"
                            },
                            "number": {
                                "type": "string"
                            },
                            "digits": {
                                "type": "string"
                            }
                        }
                    },
                    {
                        "type": "array",
                        "items": {
                            "anyOf": [
                                {
                                    "type": "string"
                                }
                            ]
                        }
                    }
                ]
            }
        },
        "test": {
            "type": "string"
        }
    }
}